MR,Author,Journal,Year,Publication Type,Citation,Version,Website,Lentght,Accuracy Score,Lenght
3942387,"Abbas, A. and Assi, A. and García-Sánchez, P. A.",Rev. R. Acad. Cienc. Exactas Fís. Nat. Ser. A Mat. RACSAM,2019,article,"Delgado, M., García-Sánchez, P.A., Morais, J.: ""Numerical Sgps"", A GAP package for numerical semi-groups. https://gap-packages.github.io/numericalsgps. Accessed 19 Aug 2017 
MR3493240",Package,Yes,183,3,183
2726552,"Abdollahi, A. and Khosravi, H.",J. Algebra Appl.,2010,article,"W. Nickel, NQ, 1998, A refereed GAP 4 package, see [10].",Package,No,56,1,56
3149684,"Abdollahi, A. and Jazaeri, M.",European J. Combin.,2014,article,"L.H. Soicher, The GRAPE package for GAP, Version 4.6.1, 2012. http://www.maths.qmul.ac.uk/simleonard/grape/.",Package,Yes,108,3,108
3297734,"Abdollahi, A.",J. Group Theory,2015,article,"W. Nickel, NQ, 1998, A refereed GAP 4 package, see [8].",Package,No,55,1,55
3539599,"Abdollahi, A. and Janbaz, S. and Jazaeri, M.",J. Algebra Appl.,2016,article,"L. H. Soicher, The GRAPE package for GAP, Version 4.6.1, 2012, http://www.maths.qmul.ac.uk/~leonard/grape/.",Package,Yes,107,3,107
4089644,"Abdollahi, A. and Rahmani, N.",Bull. Malays. Math. Sci. Soc.,2020,article,"Gamble, G., Nickel, W., O'Brien, E.A.: ANU p-Quotient–p-Quotient and p-Group Generation Algorithms (2006). An accepted GAP 4 package, available also in MAGMA",Package,No,157,2,157
3449941,"Aboras, M. and Vojtěchovský, P.",Comm. Algebra,2016,article,"Nagy, G. P., Vojtěchovský, P. LOOPS: Computing with quasigroups and loops, version 2.2.0, a package for GAP, available at http://www.math.du.edu/loops.",Package,Yes,151,3,151
3468053,"AbuGhneim, O. A.",Ars Combin.,2016,article,"L.H. Soicher, The DESIGN package for GAP, Version 1.6, 2011, (http://designtheory.org/software/gap_design/).",Package,Yes,108,3,108
3468053,"AbuGhneim, O. A.",Ars Combin.,2016,article,"L.H. Soicher, The GRAPE package for GAP, Version 4.6.1, 2012, (http://www.maths.qmul.ac.uk/leonard/grape/).",Package,Yes,107,3,107
2729387,"Aguiló-Gost, F. and García-Sánchez, P. A.",Electron. J. Combin.,2010,article,"M. Delgado, P. A. García-Sánchez and J. Morais, ""numericalsgps"": a GAP [12] package on numerical semigroups. (http://www.gap-system.org/Packages/numericalsgps.html). 
MR3493240",Package,Yes,176,3,176
3373319,"Aguiló-Gost, F. and García-Sánchez, P. A. and Llena, D.",Discrete Math.,2015,article,"M. Delgado, P. A. García-Sánchez, J. Morais, ""NumericalSgps"", A GAP package for numerical semigroups. Available via http://www.gap-system.org.",Package,Yes,142,3,142
3786749,"Ahmadidelir, K.",J. Algebra Appl.,2018,article,"G. P. Nagy and P. Vojtěchovský, LOOPS Version 2.1.3, Package for GAP 4.4.12., http://www.math.du.edu/loops.",Package,Yes,107,3,107
3786749,"Ahmadidelir, K.",J. Algebra Appl.,2018,article,"L. H. Soicher, The GRAPE package for GAP, Version 4.6.1, 2012, http://www.maths.qmul.ac.uk/leonard/grape/.",Package,Yes,106,3,106
3963088,"Ahmed, E. and Savchuk, D.",Comm. Algebra,2019,article,"Muntyan, Y., Savchuk, D. (2016). AutomGrp – tt GAP package for computations in self-similar groups and semigroups, Version 1.3. Accepted GAP package. Available at http://www.gap-system.org/Packages/automgrp.html",Package,Yes,211,3,211
1871890,"Aichinger, E.",Quaest. Math.,2001,article,"E. Aichinger, F. Binder, J. Ecker, R. Eggetsberger, P. Mayr, and C. Nöbauer, SONATA - system of near-rings and their applications, package for the group theory system GAP4, Division of Algebra, Johannes Kepler University Linz, Austria, 1999. 
MR1492191",Package,No,252,2,252
1916567,"Aichinger, E.",Acta Sci. Math. (Szeged),2002,article,"E. Aichinger, F. Binder, J. Ecker, R. Eggetsberger, P. Mayr, and C. Nöbauer, SONATA–system of near-rings and their applications, package for the group theory system GAP4, Division of Algebra, Johannes Kepler University Linz, Austria, 1999. 
MR1492191",Package,No,250,2,250
2167009,"Aichinger, E. and Farag, M.",Aequationes Math.,2004,article,"E. Aichinger, F. Binder, J, Ecker, R. Eggetsberger, P. Mayr and C. Nöbauer, SONATA - system of near-rings and their applications, package for the group theory system GAP4, Division of Algebra, Johannes Kepler University Linz, Austria, 1999. 
MR1492191",Package,No,251,2,251
2501429,"Albert, M. H. and Linton, S. A.",Combin. Probab. Comput.,2009,article,"Delgado, M., Linton, S. and Morais, J. (2007) Automata: A GAP package (1.10). http://cmup.fc.up.pt/cmup/mdelgado/automata/",Package,Yes,122,3,122
4180130,"Ali, S. and Azad, H. and Biswas, I. and de Graaf, W. A.",J. Symbolic Comput.,2021,article,"Dietrich, H., Faccin, P., de Graaf, W.A., 2019. CoReLG, computation with real Lie groups, Version 1.53. https://gap-packages.github.io/corelg/. Refereed GAP package.",Package,Yes,165,3,165
3763899,"Aljohani, M. and Bamberg, J. and Cameron, P. J.",Port. Math.,2017,article,"L. H. Soicher, GRAPE (Version 4.7) Package for GAP, http://www.maths.qmul.ac.uk/~leonard/grape/",Package,Yes,95,3,95
4095494,"Almeida, J. and Costa, A. and Kyriakoglou, R. and Perrin, D.",Forum Math.,2020,article,"M. Delgado, S. Linton and J. Morais, Automata: A GAP package on finite automata, http://www.gap-system.org/Packages/automata.html.",Package,Yes,130,3,130
4095494,"Almeida, J. and Costa, A. and Kyriakoglou, R. and Perrin, D.",Forum Math.,2020,article,"M. Delgado and J. Morais, SgpViz: A GAP package to visualize finite semigroups, 2008, http://www.gap-system.org/Packages/sgpviz.html.",Package,Yes,133,3,133
1776049,"Alp, M. and Wensley, C. D.",Internat. J. Algebra Comput.,2000,article,"M. Alp and C. D. Wensley, XMOD—Crossed modules and Cat1-groups in GAP, version 1.3—Manual for the XMOD share package (1997), pp. 1–78.",Package,No,134,2,134
1935568,"Alp, M.",Internat. J. Algebra Comput.,2002,article,"M. Alp and C. D. Wensley, XMOD—Crossed modules and Cat1-groups in GAP, version 1.3 Manual for the XMOD share package (1996) 1–80.",Package,No,129,2,129
2248746,"Alp, M.",Turkish J. Math.,2006,article,"Alp, M., and Wensley, C. D., XMOD, Crossed modules and cat1-groups in GAP, version 1.3 Manual for the XMOD share package, 1–80, (1997).",Package,No,135,2,135
1840174,"Alp, M.",Turkish J. Math.,2001,article,"Alp, M., and Wensley, C. D., XMOD, Crossed modules and cat1-groups in GAP, version 1.3 Manual for the XMOD share package, Chapter 73, 1357–1422.",Package,No,144,2,144
1796665,"Alp, M.",Turkish J. Math.,2000,article,"Alp, M., and Wensley, C. D., XMOD, Crossed modules and cat1-groups in GAP, version 1.3 Manual for the XMOD share package, (1996) 1–80.",Package,No,134,2,134
2917119,"Álvarez, V. and Armario, J. A. and Frau, M. D. and Real, P.",Appl. Algebra Engrg. Comm. Comput.,2012,article,Homological Algebra programming. A package for the GAP computational algebra system. http://www.gap-system.org/Packages/hap.html,Package,Yes,128,3,128
2220418,"An, J. and Hiss, G.",J. Group Theory,2006,article,"M. Schönert et al. GAP—Groups, Algorithms, and Programming. Version 3, share package CHEVIE. Lehrstuhl D für Mathematik, RWTH Aachen University (1997). http://www.gap-system.org.",Package,Yes,178,3,178
2652482,"Andruskiewitsch, N. and Fantino, F. and Graña, M. and Vendramin, L.",C. R. Math. Acad. Sci. Paris,2010,article,"R.A. Wilson, R.A. Parker, S.J. Nickerson, J.N. Bray, T. Breuer, AtlasRep, A GAP Interface to the Atlas of Group Representations, Version 1.4 2008, Refereed GAP package, http://www.math.rwth-aachen.de/simThomas.Breuer/atlasrep.",Package,Yes,226,3,226
2786171,"Andruskiewitsch, N. and Fantino, F. and Graña, M. and Vendramin, L.",Ann. Mat. Pura Appl. (4),2011,article,"Graña M., Vendramin L.: RiG, A GAP package for racks and Nichols Algebras, available at http://mate. dm.uba.ar/simlvendram",Package,Yes,122,3,122
2840161,"Andruskiewitsch, N. and Fantino, F. and García, G. A. and Vendramin, L.",Rev. Un. Mat. Argentina,2010,article,"R. A. Wilson, R. A. Parker, S. Nickerson, J. N. Bray and T. Breuer, Atlas Rep, A GAP Interface to the ATLAS of Group Representations. Version 1.4, http://www.math.rwth-aachen.de/simThomas.Breuer/atlasrep, 2007, Refereed GAP package.",Package,Yes,232,3,232
2745542,"Andruskiewitsch, N. and Fantino, F. and Graña, M. and Vendramin, L.",J. Algebra,2011,article,"R.A. Wilson, R.A. Parker, S. Nickerson, J.N. Bray, T. Breuer, AtlasRep, A GAP Interface to the ATLAS of Group Representations, Version 1.4, refereed GAP package, http://www.math.rwth-aachen.de/simThomas.Breuer/atlasrep, 2007.",Package,Yes,225,3,225
2745541,"Andruskiewitsch, N. and Fantino, F. and Graña, M. and Vendramin, L.",J. Algebra,2011,article,"R.A. Wilson, R.A. Parker, S. Nickerson, J.N. Bray, T. Breuer, AtlasRep, A GAP Interface to the ATLAS of Group Representations, Version 1.4, 2007, refereed GAP package. http://www.math.rwth-aachen.de/simThomas.Breuer/atlasrep.",Package,Yes,225,3,225
2862555,"Ankaralioglu, N. and Seress, Á.",Discrete Math. Theor. Comput. Sci.,2011,article,"M. Neunhöffer, Á. Seress, GAP Package ""recogbase"", http://www-groups.mcs.st-and.ac.uk/simneunhoef/ Computer/Software/Gap/recogbase.html.",Package,Yes,136,3,136
2862555,"Ankaralioglu, N. and Seress, Á.",Discrete Math. Theor. Comput. Sci.,2011,article,"M. Neunhöffer, Á. Seress, GAP Package ""recog"", http://www-groups.mcs.st-and.ac.uk/simneunhoef/ Computer/Software/Gap/recog.html.",Package,Yes,128,3,128
2738539,"Araújo, J. and Kinyon, M. and Konieczny, J.",European J. Combin.,2011,article,"L.H. Soicher, The GRAPE package for GAP, Version 4.3, 2006. http://www.maths.qmul.ac.uk/-leonard/grape/.",Package,Yes,104,3,104
3358042,"Araújo, J. and Bentz, W. and Konieczny, J.",Israel J. Math.,2015,article,"L. H. Soicher, The GRAPE package for GAP, Version 4.3, 2006, http://www.maths.qmul.ac.uk/~leonard/grape/.",Package,Yes,105,3,105
3725240,"Araújo, J. and Cameron, P. J. and Steinberg, B.",EMS Surv. Math. Sci.,2017,article,"J. D. Mitchell et al., Semigroups - GAP package, Version 2.6; 2015. Available from: http://www-groups.mcs.st-andrews.ac.uk/~jamesm/semigroups.php",Package,Yes,145,3,145
3724696,"Araújo, J. and Kinyon, M. and Konieczny, J. and Malheiro, A.",Proc. Roy. Soc. Edinburgh Sect. A,2017,article,"A. Distler and J. D. Mitchell. GAP package - smallsemi, v. 0.6.8 (2014). (Available at http://www-groups.mcs.st-andrews.ac.uk/~jamesm/smallsemi.)",Package,Yes,145,3,145
2995039,"Araújo, J. and Cameron, P. J. and Mitchell, J. D. and Neunhöffer, M.",J. Algebra,2013,article,"James D. Mitchell, The GAP-package Citrus. Version 0.6, http://www-groups.mcs.st-andrews.ac.uk/simjamesm/citrus/index.html, 2012.",Package,Yes,129,3,129
2995039,"Araújo, J. and Cameron, P. J. and Mitchell, J. D. and Neunhöffer, M.",J. Algebra,2013,article,"Jürgen Müller, Max Neunhöffer, Felix Noeske, The GAP-package orb. Version 4.3, http://www-groups.mcs.st-and.ac.uk/simneunhoef/ Computer/Software/Gap/orb.html, 2012.",Package,Yes,164,3,164
3395375,"Araújo, J. and Bentz, W. and Mitchell, J. D. and Schneider, C.",Math. Proc. Cambridge Philos. Soc.,2015,article,"J. D. Mitchell et al. Semigroups - GAP package, Version 2.4.1. May 2015. http://www-groups.mcs.st-andrews.ac.uk/jamesm/semigroups.php.",Package,Yes,134,3,134
3430360,"Araújo, J. and Cameron, P. J.",Trans. Amer. Math. Soc.,2016,article,"L.H. Soicher, The GRAPE package for GAP, Version 4.3, 2006. +http://www.maths.qmul.ac.uk/~leonard/grape/+.",Package,Yes,106,3,106
3482340,"Araya, M. and Harada, M.",Hiroshima Math. J.,2016,article,"L. H. Soicher, GRAPE—a GAP package, Version 4.6.1; 2012, (http://www.gap-system.org/Packages/grape.html).",Package,Yes,105,3,105
3886270,"Araya, M. and Harada, M.",Discrete Math.,2019,article,"R. Baart, T. Boothby, J. Cramwinckel, J. Fields, D. Joyner, R. Miller, E. Minkes, E. Roijackers, L. Ruscio, C. Tjhai, GAP package GUAVA, Version 3.1.3, 2016, Available online at http://www.gap-system.org/Packages/guava.html.",Package,Yes,224,3,224
3575975,"Arvasi, Z. and Odabaş, A.",J. Algebra Appl.,2016,article,"M. Alp, A. Odabas, E. O. Uslu and C. D. Wensley, Crossed modules and romancat1-groups in GAP, Version 2.43 Manual for the XMod share package for GAP4 (2015), http://www.gap-system.org/packages/xmod.html",Package,Yes,202,3,202
3575975,"Arvasi, Z. and Odabaş, A.",J. Algebra Appl.,2016,article,"Z. Arvasi and A. Odabas, Crossed modules of commutative algebras and cat-1romanalgebras in GAP, Version 1.12 Manual for the XModAlg share package for GAP4 (2015), http://fef.ogu.edu.tr/matbil/aodabas/xmodalg.",Package,Yes,208,3,208
3424052,"Assi, A. and García-Sánchez, P. A.",J. Symbolic Comput.,2016,article,"Delgado, M., García-Sánchez, P.A., Morais, J., 2015. NumericalSgps, a package for numerical semigroups, Version 1.0.1 (Refereed GAP package). http://www.fc.up.pt/cmup/mdelgado/numericalsgps. 
MR3493240",Package,Yes,201,3,201
3550351,"Assi, A. and García-Sánchez, P. A. and Micale, V.",J. Symbolic Comput.,2017,article,"Delgado, M., García-Sánchez, P.A., Morais, J., 2015. ""NumericalSgps"", a GAP package for numerical semigroups. Available via http://www.gap-system.org. 
MR3493240",Package,Yes,161,3,161
2178086,"Assmann, B. and Eick, B.",J. Symbolic Comput.,2005,article,"Assmann, B., 2003a. Polenta—Polycyclic presentations for matrix groups. A deposited GAP 4 package; see The GAP Group (2004).",Package,No,124,2,124
2178086,"Assmann, B. and Eick, B.",J. Symbolic Comput.,2005,article,"Assmann, B., Eick, B., 2003. ALNUTH—ALgebraic NUmber THeory and an interface to the KANT system. A refereed GAP 4 package; see The GAP Group (2004).",Package,No,148,2,148
2178086,"Assmann, B. and Eick, B.",J. Symbolic Comput.,2005,article,"Dekimpe, K., Eick, B., 2000. Aclib—a library of almost crystallographic groups. A refereed GAP 4 package; see The GAP Group (2004).",Package,No,131,2,131
2178086,"Assmann, B. and Eick, B.",J. Symbolic Comput.,2005,article,"Eick, B., Nickel, W., 2000. Polycyclic—computing with polycyclic groups. A refereed GAP 4 package; see The GAP Group (2004). 
MR1829476",Package,No,135,2,135
2299794,"Assmann, B. and Eick, B.",Math. Comp.,2007,article,"B. Assmann. Polenta - Polycyclic presentations for matrix groups, 2006. A refereed GAP 4 package, see [14].",Package,No,107,2,107
2358616,"Assmann, B. and Linton, S.",J. Algebra,2007,article,"B. Assmann, Guarana—Applications of Lie methods in computational group theory, 2006, A GAP 4 package, see [23].",Package,No,111,2,111
2358616,"Assmann, B. and Linton, S.",J. Algebra,2007,article,"W. Nickel, NQ, 1998, A refereed GAP 4 package, see [23].",Package,No,56,1,56
3544422,"Azizi, A. and Talbi, M. and Talbi, M. and Derhem, A. and Mayer, D. C.",Int. J. Number Theory,2016,article,"H. U. Besche, B. Eick and E. A. O'Brien, The Small Groups Library — a library of groups of small order, (2005); an accepted and refereed GAP 4 package, available also in MAGMA.",Package,No,176,2,176
3544422,"Azizi, A. and Talbi, M. and Talbi, M. and Derhem, A. and Mayer, D. C.",Int. J. Number Theory,2016,article,"G. Gamble, W. Nickel and E. A. O'Brien, ANU p-Quotient — p-quotient and p-group generation algorithms, (2006); an accepted GAP 4 package, available also in MAGMA.",Package,No,162,2,162
3658506,"Bächle, A. and Caicedo, M.",Internat. J. Algebra Comput.,2017,article,"A. Bächle and L. Margolis, HeLP – A GAP package for torsion units in integral group rings, preprint (2015), arXiv:1507.08174 [math.RT]. 
MR3820369",Package,No,146,2,146
3658506,"Bächle, A. and Caicedo, M.",Internat. J. Algebra Comput.,2017,article,"A. Bächle and L. Margolis, HeLP – Hertweck–Luthar–Passi method, GAP package, Version 2.1 (2015), http://homepages.vub.ac.be/abachle/help/. 
MR3820369",Package,Yes,149,3,149
3708050,"Bächle, A. and Margolis, L.",Internat. J. Algebra Comput.,2017,article,"A. Bächle and L. Margolis, HeLP – A GAP package for torsion units in integral group rings, submitted, preprint (2015), arXiv:1507.08174 [math.RT]. 
MR3820369",Package,No,157,2,157
3708050,"Bächle, A. and Margolis, L.",Internat. J. Algebra Comput.,2017,article,"A. Bächle and L. Margolis, HeLP – Hertweck–Luthar–Passi method, GAP package, Version 2.2, http://homepages.vub.ac.be/abachle/help/(2015).",Package,Yes,137,3,137
3708050,"Bächle, A. and Margolis, L.",Internat. J. Algebra Comput.,2017,article,"T. Breuer, The GAP Character Table Library, Version 1.2.1, http://www.math.rwthaachen.de/~Thomas.Breuer/ctbllib, May (2012), GAP package.",Package,Yes,137,3,137
3708050,"Bächle, A. and Margolis, L.",Internat. J. Algebra Comput.,2017,article,"R. A. Wilson, R. A. Parker, S. Nickerson, J. N. Bray and T. Breuer, AtlasRep, A GAP Interface to the Atlas of Group Representations, Version 1.5, http://www.math.rwthaachen.de/~Thomas.Breuer/atlasrep, July (2011), Refereed GAP package.",Package,Yes,235,3,235
3715687,"Bächle, A. and Margolis, L.",Proc. Edinb. Math. Soc. (2),2017,article,"T. Breuer, The GAP character table library, Version 1.2.1, GAP package (available at www.math.rwth-aachen.de/~Thomas.Breuer/ctbllib; 2012).",Package,Yes,139,3,139
3715687,"Bächle, A. and Margolis, L.",Proc. Edinb. Math. Soc. (2),2017,article,"V. Dabbaghian, REPSN – a GAP4 package for constructing representations of finite groups, Version 3.0.2, GAP package (available at www.sfu.ca/~vdabbagh/gap/repsn.html; 2011).",Package,Yes,173,3,173
3894722,"Bächle, A. and Herman, A. and Konovalov, A. and Margolis, L. and Singh, G.",Exp. Math.,2018,article,"A. Bächle and L. Margolis. HeLP – A GAP-package for torsion units in integral group rings (2016), arXiv:1507.08174v3 [math.RT]. 
cf. MR3820369",Package,No,142,2,142
4002537,"Bächle, A. and Margolis, L.",Proc. Amer. Math. Soc.,2019,article,"T. Breuer, The GAP Character Table Library, Version 1.2.1, http://www.math.rwthaachen.de/~Thomas.Breuer/ctbllib, May 2012,  GAP package.",Package,Yes,136,3,136
2273130,"Bailey, R. A. and Cameron, P. J. and Dobcsányi, P. and Morgan, J. P. and Soicher, L. H.",Discrete Math.,2006,article,"F. Lübeck, M. Neunhöffer, The GAPDoc package for GAP, (http://www.math.rwth-aachen.de/simFrank.Luebeck/GAPDoc/).",Package,Yes,112,3,112
2273130,"Bailey, R. A. and Cameron, P. J. and Dobcsányi, P. and Morgan, J. P. and Soicher, L. H.",Discrete Math.,2006,article,"L.H. Soicher, The GRAPE package for GAP, (http://www.maths.qmul.ac.uk/simleonard/grape/).",Package,Yes,89,2,89
2408485,"Bailey, R. A. and Cameron, P. J. and Connelly, R.",Amer. Math. Monthly,2008,article,"L. H. Soicher, The DESIGN package for GAP, available at http://designtheory.org/software/gap_design/.",Package,Yes,101,3,101
2684077,"Bailey, R. F. and Stevens, B.",Discrete Math.,2010,article,"L.H. Soicher, The GRAPE package for GAP, Version 4.3, 2006, http://www.maths.qmul.ac.uk/simleonard/grape/.",Package,Yes,106,3,106
3337174,"Bailey, R. F.",Australas. J. Combin.,2015,article,"J. Bamberg et al., FinInG—a finite geometry package for GAP, Version 1.0, 2011; cage.ugent.be/fining/.",Package,No,102,2,102
3337174,"Bailey, R. F.",Australas. J. Combin.,2015,article,"C. Pech and S. Reichard, The SetOrbit package for GAP, www.math.tu-dresden.de/simpech/SetOrbit/.",Package,Yes,96,3,96
3337174,"Bailey, R. F.",Australas. J. Combin.,2015,article,"L. H. Soicher, The GRAPE package for GAP, Version 4.6.1, 2012, www.maths.qmul.ac.uk/simleonard/grape/.",Package,Yes,102,3,102
3337174,"Bailey, R. F.",Australas. J. Combin.,2015,article,"L. H. Soicher, The DESIGN package for GAP, Version 1.6, 2011, designtheory.org/software/gap_design/.",Package,No,100,2,100
3092787,"Ballester-Bolinches, A. and Cosme-Llópez, E. and Esteban-Romero, R.",Cent. Eur. J. Math.,2013,article,"Ballester-Bolinches A., Cosme-Llópez E., Esteban–Romero R., Permut: A GAP4 package to deal with permutability, v.0.03, available at http://personales.upv.es/simresteban/gap/permut-0.03/",Package,Yes,185,3,185
2555698,"Ballinger, B. and Blekherman, G. and Cohn, H. and Giansiracusa, N. and Kelly, E. and Schürmann, A.",Experiment. Math.,2009,article,"M. Dutour Sikirić. ""Polyhedral,"" a package for GAP. Available online (http://www.liga.ens.fr/simdutour/Polyhedral/index.html), 2006.",Package,Yes,132,3,132
3325626,"Bamberg, J. and Devillers, A. and Fawcett, J. B. and Praeger, C. E.",J. Combin. Theory Ser. A,2015,article,"J. Bamberg, A. Betten, P. Cara, J. De Beule, M. Lavrauw, M. Neunhoeffer, FinInG–a romanGAP package, Version 1.0, http://cage.ugent.be/geometry/fining.php, 2013.",Package,Yes,160,3,160
3325626,"Bamberg, J. and Devillers, A. and Fawcett, J. B. and Praeger, C. E.",J. Combin. Theory Ser. A,2015,article,"L.H. Soicher, Grape–a romanGAP package, Version 4.3, http://www.maths.qmul.ac.uk/simleonard/grape/, 2012.",Package,Yes,105,3,105
4125850,"Bannai, E. and Navarro, G. and Rizo, N. and Tiep, P. H.",J. Math. Soc. Japan,2020,article,"J. Michel, The development version of the CHEVIE package of GAP3, J. Algebra, 435 (2015), 308–336. 
MR3343221",Package,No,109,2,109
2795737,"Barakat, M. and Lange-Hegermann, M.",J. Algebra Appl.,2011,article,"M. Barakat, The homalg Package—A GAP4 meta-package for homological algebra, 2007–2010, http://homalg.math.rwth-aachen.de/index.php/ core-packages/homalg-package.",Package,Yes,161,3,161
3261464,"Barakat, M. and Lange-Hegermann, M.",J. Algebra,2014,article,"Mohamed Barakat, Markus Lange-Hegermann, The homalg package—A homological algebra GAP4 meta-package for computable Abelian categories, http://homalg.math.rwth-aachen.de/index.php/core-packages/homalg-package, 2007–2014.",Package,Yes,219,3,219
4113853,"Bardakov, V. G. and Neshchadim, M. V. and Yadav, M. K.",Internat. J. Algebra Comput.,2020,article,"B. Eick, H. U. Besche and E. O'Brien, SmallGrp – A GAP package, version 1.3 (2018), https://www.gap-system.org/Packages/smallgrp.html.",Package,Yes,134,3,134
3647965,"Barron, T. and O'Neill, C. and Pelayo, R.",Math. Comp.,2017,article,"M. Delgado, P. García-Sánchez, and J. Morais, GAP Numerical Semigroups Package, http://www.gap-system.org/Manuals/pkg/numericalsgps/doc/manual.pdf.",Package,Yes,147,3,147
3917961,"Barucci, V. and Strazzanti, F.",Semigroup Forum,2019,article,"Delgado, M., García-Sánchez, P.A., Morais, J.: ""NumericalSgps""—a GAP package, Version 1.1.5. http://www.gap-system.org/Packages/numericalsgps.html. Accessed 25 Sept 2017",Package,Yes,169,3,169
2090062,"Baur, K. and Draisma, J.",J. Algebra,2004,article,"A.M. Cohen, D.A.H. Gijsbers, GBNP: a non-commutative Gröbner basis package in GAP, http://www.win.tue.nl/simamc/pub/grobner/doc.html.",Package,Yes,133,3,133
2339279,"Baur, K. and Draisma, J. and de Graaf, W. A.",Experiment. Math.,2007,article,"W. A. de Graaf. ""QuaGroup."" A GAP package, version 1.1 (see [GAP 02]), 2005.",Package,No,76,1,76
3626252,"Becker, P. E. and Derka, M. and Houghten, S. and Ulrich, J.",Amer. Math. Monthly,2017,article,"The GUAVA Group, GUAVA: A GAP4 Package for computing with error-correcting codes, Version 3.12 (2012), http://www.gap-system.org.",Package,Yes,129,3,129
4160306,"Bendel, C. P. and Nakano, D. K. and Pillen, C. and Sobaje, P.",J. Reine Angew. Math.,2020,article,"S. Doty, WeylModules, a GAP package, Version 1.1, 2009, http://doty.math.luc.edu/weylmodules.",Package,Yes,93,3,93
2171086,"Benini, A. and Morini, F.",Discrete Math.,2005,article,"E. Aichinger, F. Binder, J. Ecker, P. Mayr, C. Nöbaner, SONATA—system of near-rings and their applications, Package for the group theory system GAP4, 2002.",Package,No,155,2,155
3147207,"Berman, L. W. and Mixer, M. and Monson, B. and Oliveros, D. and Williams, G.",Discrete Math.,2014,article,"B. Eick, F. Gähler, W. Nickel, The GAP package Cryst, http://www.math.uni-bielefeld.de/simgaehler/.",Package,Yes,99,3,99
3147207,"Berman, L. W. and Mixer, M. and Monson, B. and Oliveros, D. and Williams, G.",Discrete Math.,2014,article,"V. Felsch, F. Gähler, The GAP package CrystCat, http://www.math.uni-bielefeld.de/simgaehler/.",Package,Yes,93,3,93
3147207,"Berman, L. W. and Mixer, M. and Monson, B. and Oliveros, D. and Williams, G.",Discrete Math.,2014,article,"F. Gähler, The GAP package Carat, http://www.math.uni-bielefeld.de/simgaehler/.",Package,Yes,79,2,79
3848461,"Bernardi, A. and Vanzo, D.",Ann. Mat. Pura Appl. (4),2018,article,"de Graaf, W.A.:  SLA—computing with Simple Lie Algebras, a  GAP4 package, version 1.1 (2016). http://science.unitn.it/~degraaf/sla.html",Package,Yes,135,3,135
2103323,"Bessis, D. and Michel, J.",Experiment. Math.,2004,article,"D. Bessis and J. Michel. ""VKCURVE, Software Package for GAP3."" Available from World Wide Web (http://www.math.jussieu.fr/simjmichel/vkcurve.html), 2003",Package,Yes,151,3,151
2171593,"Bessis, D.",J. Math. Sci. (N.Y.),2005,incollection,"D. Bessis and J. Michel, VKCURVE, software package for romanGAP3, source and documentation available at: http://www.math.jussieu.fr/ jmichel/vkcurve.html",Package,Yes,153,3,153
1840383,"Binder, F. and Mayr, P.",J. Symbolic Comput.,2001,incollection,"Aichinger, E., Binder, F., Ecker, J., Eggetsberger, R., Mayr, P., Nöbauer, C. (2000). SONATA: Systems of Nearrings and Their Applications, Package for the group theory system GAP4, Austria, Universität Linz. Available at http://www.algebra.uni-linz.ac.at/sonata/.",Package,Yes,263,3,263
2996872,"Bishop, M. and Douglass, J. M. and Pfeiffer, G. and Röhrle, G.",J. Symbolic Comput.,2013,article,"Pfeiffer, G., 2007. ZigZag—A GAP3 Package for Descent Algebras of Finite Coxeter Groups. Electronically available at: http://schmidt.nuigalway.ie/zigzag.",Package,Yes,153,3,153
3008911,"Bishop, M. and Douglass, J. M. and Pfeiffer, G. and Röhrle, G.",J. Algebra,2013,article,"G. Pfeiffer, ZigZag - A GAP3 package for descent algebras of finite Coxeter groups, http://schmidt.nuigalway.ie/zigzag, 2011.",Package,Yes,125,3,125
3283755,"Bishop, M. and Douglass, J. M. and Pfeiffer, G. and Röhrle, G.",J. Algebra,2015,article,"G. Pfeiffer, ZigZag—a GAP3 package for descent algebras of finite Coxeter groups, electronically available at http://schmidt.nuigalway.ie/zigzag, 2007.",Package,Yes,151,3,151
